{
  "$schema": "https://ui.shadcn.com/schema/registry-item.json",
  "name": "form",
  "type": "registry:component",
  "description": "Form component",
  "dependencies": [
    "radix-ui",
    "ajv",
    "ajv-formats",
    "ajv-errors"
  ],
  "registryDependencies": [
    "https://auradesignsystem.com/r/use-dynamic-form.json",
    "https://auradesignsystem.com/r/web-validation.json"
  ],
  "files": [
    {
      "path": "registry/default/components/form.tsx",
      "content": "import * as React from \"react\";\nimport { ErrorObject } from \"ajv\";\nimport {\n  Form as FormRadix,\n  Switch as SwitchRadix,\n  Checkbox as CheckboxRadix,\n} from \"radix-ui\";\nimport { ChevronDownIcon, CheckIcon, SymbolIcon } from \"@radix-ui/react-icons\";\n\nimport { FieldProps } from \"@/hooks/use-dynamic-form\";\nimport Alert, { AlertProps } from \"@/components/ui/alert\";\nimport Button, { ButtonProps } from \"@/components/ui/button\";\n\ninterface FormProps extends FormRadix.FormProps {\n  errors?: ErrorObject<string, Record<string, any>, unknown>[];\n}\nexport const Form = React.forwardRef<HTMLFormElement, FormProps>(\n  ({ children, errors, ...props }, forwardedRef) => {\n    const childrenArray = React.Children.toArray(children);\n\n    const processChildren = (\n      children: React.ReactNode[]\n    ): React.ReactNode[] => {\n      return children.map((child) => {\n        if (!React.isValidElement(child)) {\n          return child;\n        }\n\n        if (child.props?.field) {\n          const fieldErrors = errors?.filter(\n            (error) => error.instancePath.slice(1) === child.props?.field?.name\n          );\n\n          return React.cloneElement(child as React.ReactElement, {\n            ...child.props,\n            errors: fieldErrors,\n          });\n        }\n\n        if (child.props?.children) {\n          const processedChildren = processChildren(\n            React.Children.toArray(child.props.children)\n          );\n          return React.cloneElement(child as React.ReactElement, {\n            ...child.props,\n            children: processedChildren,\n          });\n        }\n\n        return child;\n      });\n    };\n\n    return (\n      <FormRadix.Root {...props} ref={forwardedRef}>\n        {processChildren(childrenArray)}\n      </FormRadix.Root>\n    );\n  }\n);\n\ninterface FormSubmitProps extends FormRadix.FormSubmitProps {\n  buttonProps?: ButtonProps;\n  fetchStatus?: \"idle\" | \"loading\" | \"success\" | \"error\";\n}\n\nexport const FormSubmit = React.forwardRef<HTMLButtonElement, FormSubmitProps>(\n  ({ buttonProps, fetchStatus, ...props }, forwardedRef) => {\n    return (\n      <FormRadix.Submit {...props} ref={forwardedRef} asChild>\n        <Button\n          {...buttonProps}\n          isLoading={fetchStatus === \"loading\"}\n          isLoadingText={\n            <>\n              <SymbolIcon className=\"icon animate-spin\" />\n            </>\n          }\n          className=\"min-w-10\"\n        />\n      </FormRadix.Submit>\n    );\n  }\n);\n\ninterface FormFieldProps extends Partial<FormRadix.FormFieldProps> {\n  label: React.ReactNode;\n  labelProps?: FormRadix.FormLabelProps;\n  controlProps?: FormRadix.FormControlProps;\n  field?: FieldProps;\n  errors?: ErrorObject<string, Record<string, any>, unknown>[];\n}\n\nexport const FormField = React.forwardRef<HTMLDivElement, FormFieldProps>(\n  (\n    { labelProps, label, controlProps, children, field, errors, ...props },\n    forwardedRef\n  ) => {\n    const classNameConnect: string[] = [\"flex flex-col gap-0.5\"];\n    const hasError = field.touch && errors && errors.length > 0;\n    const hasSelect = React.Children.toArray(children).some(\n      (child: any) => child?.type === \"select\"\n    );\n\n    if (props.className) {\n      classNameConnect.push(props.className);\n    }\n\n    const name = props.name || field?.name;\n\n    return (\n      <FormRadix.Field\n        className={classNameConnect.join(\" \")}\n        name={name}\n        {...props}\n        serverInvalid={hasError}\n        ref={forwardedRef}\n      >\n        {label && <FormRadix.Label {...labelProps}>{label}</FormRadix.Label>}\n        <div className=\"relative \">\n          <FormRadix.Control\n            {...controlProps}\n            onChange={field?.onChange}\n            asChild={Boolean(children)}\n          >\n            {children}\n          </FormRadix.Control>\n          {hasSelect && (\n            <div className=\"absolute top-1/2 -translate-y-1/2 right-2 pointer-events-none\">\n              <ChevronDownIcon className=\"icon\" />\n            </div>\n          )}\n        </div>\n\n        {hasError &&\n          errors?.map((error, index) => (\n            <FormRadix.Message className=\"text-warning-contrast\" key={index}>\n              {error.message}\n            </FormRadix.Message>\n          ))}\n      </FormRadix.Field>\n    );\n  }\n);\n\ninterface FormSwitchProps extends Partial<FormRadix.FormFieldProps> {\n  id?: string;\n  label: React.ReactNode;\n  labelProps?: FormRadix.FormLabelProps;\n  controlProps?: FormRadix.FormControlProps;\n  field?: FieldProps;\n  errors?: ErrorObject<string, Record<string, any>, unknown>[];\n}\n\nexport const FormSwitch = React.forwardRef<HTMLDivElement, FormSwitchProps>(\n  (\n    { labelProps, label, controlProps, field, children, id, errors, ...props },\n    forwardedRef\n  ) => {\n    const hasError = field.touch && errors && errors.length > 0;\n    const idConnect = id ? id : React.useId();\n    const name = props.name || field?.name;\n\n    return (\n      <FormRadix.Field\n        {...props}\n        ref={forwardedRef}\n        name={name}\n        serverInvalid={hasError}\n      >\n        <div className=\"flex items-center gap-1\">\n          {label && (\n            <FormRadix.Label htmlFor={idConnect}>{label}</FormRadix.Label>\n          )}\n          <SwitchRadix.Root\n            id={idConnect}\n            checked={Boolean(field?.value)}\n            onCheckedChange={field?.onCheckedChange}\n            className=\"relative h-1.5 w-2.5 cursor-pointer rounded-full outline-none bg-black-4 data-[state=checked]:bg-black-10\"\n          >\n            <SwitchRadix.Thumb className=\"block size-1 translate-x-[3.5px] rounded-full bg-black-1 shadow-md transition-transform duration-100 will-change-transform data-[state=checked]:translate-x-[15.5px]\" />\n          </SwitchRadix.Root>\n        </div>\n        <FormRadix.Control\n          value=\"on\"\n          type=\"checkbox\"\n          checked={Boolean(field?.value)}\n          onChange={field?.onCheckedChange}\n          className=\"border-0 absolute w-px h-px p-0 -m-px overflow-hidden whitespace-nowrap break-normal clip-rect hidden\"\n        />\n        {hasError &&\n          errors?.map((error, index) => (\n            <FormRadix.Message className=\"text-warning-contrast\" key={index}>\n              {error.message}\n            </FormRadix.Message>\n          ))}\n      </FormRadix.Field>\n    );\n  }\n);\n\ninterface FormCheckboxProps extends Partial<FormRadix.FormFieldProps> {\n  id?: string;\n  label: React.ReactNode;\n  labelProps?: FormRadix.FormLabelProps;\n  controlProps?: FormRadix.FormControlProps;\n  field?: FieldProps;\n  errors?: ErrorObject<string, Record<string, any>, unknown>[];\n}\n\nexport const FormCheckbox = React.forwardRef<HTMLDivElement, FormCheckboxProps>(\n  (\n    { labelProps, label, controlProps, field, children, id, errors, ...props },\n    forwardedRef\n  ) => {\n    const hasError = field.touch && errors && errors.length > 0;\n    const idConnect = id ? id : React.useId();\n    const name = props.name || field?.name;\n    return (\n      <FormRadix.Field\n        {...props}\n        ref={forwardedRef}\n        name={name}\n        serverInvalid={hasError}\n      >\n        <div className=\"flex items-center gap-1\">\n          <div>\n          <CheckboxRadix.Root\n            id={idConnect}\n            className=\"border flex size-1.5 items-center justify-center rounded outline-none\"\n            checked={Boolean(field?.value)}\n            onCheckedChange={field?.onCheckedChange}\n          >\n            <CheckboxRadix.Indicator>\n              <CheckIcon />\n            </CheckboxRadix.Indicator>\n          </CheckboxRadix.Root>\n          </div>\n          {label && (\n            <FormRadix.Label htmlFor={idConnect}>{label}</FormRadix.Label>\n          )}\n        </div>\n        <FormRadix.Control\n          value=\"on\"\n          type=\"checkbox\"\n          checked={Boolean(field?.value)}\n          onChange={field?.onCheckedChange}\n          className=\"border-0 absolute w-px h-px p-0 -m-px overflow-hidden whitespace-nowrap break-normal clip-rect hidden\"\n        />\n        {hasError &&\n          errors?.map((error, index) => (\n            <FormRadix.Message className=\"text-warning-contrast\" key={index}>\n              {error.message}\n            </FormRadix.Message>\n          ))}\n      </FormRadix.Field>\n    );\n  }\n);\n\ninterface FormAlertProps extends AlertProps {\n  formData: any;\n}\n\nexport const FormAlert = ({ children, formData, ...props }: FormAlertProps) => {\n  if (formData.fetchStatus !== \"error\") {\n    return null;\n  }\n  return <Alert status=\"danger\" {...props} label={formData.error} />;\n};\n",
      "type": "registry:component"
    }
  ]
}