{
  "$schema": "https://ui.shadcn.com/schema/registry-item.json",
  "name": "radio-group",
  "type": "registry:ui",
  "description": "A set of checkable buttons—known as radio buttons—where no more than one of the buttons can be checked at a time.",
  "dependencies": [
    "@radix-ui/react-icons"
  ],
  "files": [
    {
      "path": "registry/default/ui/RadioGroup.tsx",
      "content": "\"use client\";\n\nimport * as React from \"react\";\nimport { RadioGroup as RadioGroupPrimitive } from \"radix-ui\";\n\nimport { cn } from \"@/utils/class-names\";\n\nfunction RadioGroup({\n  className,\n  ...props\n}: React.ComponentProps<typeof RadioGroupPrimitive.Root>) {\n  return (\n    <RadioGroupPrimitive.Root\n      data-slot=\"radio-group\"\n      className={cn(className, \"cursor-pointer\")}\n      {...props}\n    />\n  );\n}\n\nfunction RadioGroupItem({\n  className,\n  ...props\n}: React.ComponentProps<typeof RadioGroupPrimitive.Item>) {\n  return (\n    <RadioGroupPrimitive.Item\n      data-slot=\"radio-group-item\"\n      className={cn(\n        className,\n        \"size-2 cursor-pointer rounded-full border border-gray-a6 hover:bg-accent-2\"\n      )}\n      {...props}\n    >\n      <RadioGroupPrimitive.Indicator\n        data-slot=\"radio-group-indicator\"\n        className=\"relative flex size-full items-center justify-center after:block after:size-[11px] after:rounded-full after:bg-accent-9\"\n      />\n    </RadioGroupPrimitive.Item>\n  );\n}\n\nexport { RadioGroup, RadioGroupItem };\n",
      "type": "registry:ui"
    }
  ]
}