{
  "$schema": "https://ui.shadcn.com/schema/registry-item.json",
  "name": "button",
  "type": "registry:ui",
  "title": "Button",
  "description": "The Button component.",
  "dependencies": [
    "@radix-ui/react-slot",
    "class-variance-authority"
  ],
  "registryDependencies": [
    "@aura/class-names",
    "@aura/spinner"
  ],
  "files": [
    {
      "path": "registry/default/components/ui/Button.tsx",
      "content": "/**\n * @description Displays a button or a component that looks like a button.\n *\n * `mode` is a deprecated alias of `variant`. `variant=\"default\"` is a\n * deprecated alias of `fill`. Both still render and warn in development.\n * Disabled chrome (opacity and cursor) lives only in `.button:disabled`.\n * Loading sets `disabled` so the control stays non-interactive, and\n * `data-loading` so it does not fade to the disabled opacity.\n */\nimport * as React from \"react\";\nimport { Slot } from \"@radix-ui/react-slot\";\n\nimport { cva, type VariantProps } from \"class-variance-authority\";\nimport { cn } from \"@/utils/class-names\";\nimport { Spinner } from \"@/components/ui/Spinner\";\n\nconst buttonVariants = cva(\n  \"button focus-visible:[outline:var(--aura-outline)] [&_svg]:size-[1em]\",\n  {\n    variants: {\n      variant: {\n        default: \"button-fill\",\n        fill: \"button-fill\",\n        pill: \"button-pill border border-gray-6 text-gray-11 bg-gray-2 hover:bg-gray-3\",\n        link: \"button-link\",\n        menu: \"button-menu\",\n        split: \"button-fill button-split-action\",\n        splitMenu: \"button-fill button-split-menu\",\n      },\n      size: {\n        default: \"h-4\",\n        xs: \"h-2.5\",\n        sm: \"h-3\",\n        md: \"h-4\",\n        lg: \"h-5\",\n        xl: \"h-6\",\n        // `icon` and `icon-sm` are the 39px (3 × 13px) icon button. `icon-md` is 52px.\n        icon: \"w-3 h-3 p-0\",\n        \"icon-sm\": \"w-3 h-3 p-0\",\n        \"icon-md\": \"w-4 h-4 p-0\",\n      },\n    },\n    defaultVariants: {\n      variant: \"fill\",\n      size: \"default\",\n    },\n  },\n);\n\ninterface ButtonProps\n  extends React.ComponentProps<\"button\">,\n    VariantProps<typeof buttonVariants> {\n  asChild?: boolean;\n  isDisabled?: boolean;\n  isLoading?: boolean;\n  isLoadingText?: string | React.ReactNode;\n  /** @deprecated Use `variant`. Still applied, and warns in development. */\n  mode?: VariantProps<typeof buttonVariants>[\"variant\"];\n  label?: string | React.ReactNode;\n}\n\nconst deprecationWarnings = new Set<string>();\n\nfunction warnOnce(message: string) {\n  if (process.env.NODE_ENV === \"production\") return;\n  if (deprecationWarnings.has(message)) return;\n  deprecationWarnings.add(message);\n  console.warn(message);\n}\n\nfunction resolveButtonContent(\n  label: React.ReactNode,\n  children: React.ReactNode,\n): React.ReactNode {\n  const hasLabel = label != null && label !== false;\n  const hasChildren = children != null && children !== false;\n  if (hasLabel && hasChildren) {\n    warnOnce(\n      \"Button: `label` and `children` both set the visible text. Pass one. `children` is shown.\",\n    );\n    return children;\n  }\n  return hasChildren ? children : label;\n}\n\nconst Button = React.forwardRef<HTMLButtonElement, ButtonProps>(\n  (props: ButtonProps, ref) => {\n    const {\n      className,\n      variant,\n      mode,\n      size,\n      asChild = false,\n      isDisabled,\n      isLoading,\n      isLoadingText,\n      children,\n      label,\n      disabled: disabledProp,\n      ...rest\n    } = props;\n    const Comp = asChild ? Slot : \"button\";\n    const explicitlyDisabled = Boolean(isDisabled || disabledProp);\n    const loading = Boolean(isLoading);\n    const nonInteractive = explicitlyDisabled || loading;\n    const effectiveVariant = variant ?? mode;\n\n    if (mode !== undefined) {\n      warnOnce(\n        \"Button: `mode` is deprecated and duplicates `variant`. Pass `variant` instead. `mode` still works.\",\n      );\n    }\n    if (variant === \"default\" || mode === \"default\") {\n      warnOnce(\n        'Button: variant \"default\" is deprecated and matches \"fill\". Pass `variant=\"fill\"`. \"default\" still works.',\n      );\n    }\n\n    const content = resolveButtonContent(label, children);\n\n    return (\n      <Comp\n        data-slot=\"button\"\n        className={cn(\n          buttonVariants({ variant: effectiveVariant, size, className }),\n        )}\n        ref={ref}\n        {...rest}\n        data-loading={loading && !explicitlyDisabled ? true : undefined}\n        aria-busy={loading ? true : undefined}\n        disabled={nonInteractive}\n      >\n        {asChild ? (\n          children\n        ) : (\n          <>\n            {isLoading && isLoadingText ? (\n              isLoadingText\n            ) : (\n              <>\n                {isLoading ? <Spinner /> : null}\n                {content}\n              </>\n            )}\n          </>\n        )}\n      </Comp>\n    );\n  },\n);\n\nButton.displayName = \"Button\";\n\nexport { Button, buttonVariants };\nexport type { ButtonProps };\nexport default Button;\n",
      "type": "registry:ui"
    }
  ]
}
