{
  "$schema": "https://ui.shadcn.com/schema/registry-item.json",
  "name": "tabs",
  "type": "registry:ui",
  "description": "A set of layered sections of content—known as tab panels—that are displayed one at a time.",
  "files": [
    {
      "path": "registry/default/ui/Tabs.tsx",
      "content": "\"use client\";\n\nimport * as React from \"react\";\nimport { Tabs as TabsPrimitive } from \"radix-ui\";\n\nimport { cn } from \"@/lib/utils\";\n\nfunction Tabs({\n  className,\n  ...props\n}: React.ComponentProps<typeof TabsPrimitive.Root>) {\n  return (\n    <TabsPrimitive.Root data-slot=\"tabs\" className={cn(className)} {...props} />\n  );\n}\n\nfunction TabsList({\n  className,\n  ...props\n}: React.ComponentProps<typeof TabsPrimitive.List>) {\n  return (\n    <TabsPrimitive.List\n      data-slot=\"tabs-list\"\n      className={cn(className)}\n      {...props}\n    />\n  );\n}\n\nfunction TabsTrigger({\n  className,\n  ...props\n}: React.ComponentProps<typeof TabsPrimitive.Trigger>) {\n  return (\n    <TabsPrimitive.Trigger\n      data-slot=\"tabs-trigger\"\n      className={cn(className)}\n      {...props}\n    />\n  );\n}\n\nfunction TabsContent({\n  className,\n  ...props\n}: React.ComponentProps<typeof TabsPrimitive.Content>) {\n  return (\n    <TabsPrimitive.Content\n      data-slot=\"tabs-content\"\n      className={cn(className)}\n      {...props}\n    />\n  );\n}\n\nexport { Tabs, TabsList, TabsTrigger, TabsContent };\n",
      "type": "registry:ui"
    }
  ]
}