{
  "$schema": "https://ui.shadcn.com/schema/registry-item.json",
  "name": "web-validation",
  "type": "registry:lib",
  "description": "Web validation ajv ",
  "dependencies": [
    "radix-ui",
    "ajv",
    "ajv-formats",
    "ajv-errors"
  ],
  "files": [
    {
      "path": "registry/default/utils/web-validation.ts",
      "content": "import Ajv from \"ajv\";\nimport addFormats from \"ajv-formats\";\nimport addErrors from \"ajv-errors\";\n\n/**\n * Creates a new Ajv instance with specific configurations.\n * - `allErrors: true`: Enables reporting of all validation errors, not just the first one.\n * - `$data: true`: Allows the use of `$data` references in schemas, enabling dynamic validation.\n */\nconst ajv = new Ajv({ allErrors: true, $data: true });\n\n/**\n * Adds format validation keywords to the Ajv instance.\n * This includes common formats like 'date', 'time', 'email', etc.\n */\naddFormats(ajv);\n\n/**\n * Adds error message customization to the Ajv instance.\n * This allows for more descriptive and user-friendly error messages.\n */\naddErrors(ajv);\n\n/**\n * Validates form data against a provided JSON schema.\n *\n * @param schema - The JSON schema to validate against.\n * @param data - The data to validate.\n * @returns An object indicating whether the data is valid and any validation errors.\n *\n * @example\n * const schema = {\n *   type: \"object\",\n *   properties: {\n *     name: { type: \"string\" },\n *     age: { type: \"integer\", minimum: 0 },\n *   },\n *   required: [\"name\", \"age\"],\n * };\n *\n * const validData = { name: \"John Doe\", age: 30 };\n * const invalidData = { name: \"Jane Doe\", age: -5 };\n *\n * const validResult = validateFormData(schema, validData);\n * console.log(validResult); // Output: { isValid: true, errors: null }\n *\n * const invalidResult = validateFormData(schema, invalidData);\n * console.log(invalidResult); // Output: { isValid: false, errors: [...] }\n */\nexport function validateFormData(schema: object, data: unknown) {\n  /**\n   * Compiles the schema into a validation function.\n   * This function can then be used to validate data against the schema.\n   */\n  const validate = ajv.compile(schema);\n\n  /**\n   * Validates the data against the compiled schema.\n   * @returns boolean - true if the data is valid, false otherwise.\n   */\n  const isValid = validate(data);\n\n  /**\n   * If the data is not valid, return an object with isValid set to false\n   * and the errors array from the validation.\n   */\n  if (!isValid) {\n    return {\n      isValid: false,\n      errors: validate.errors,\n    };\n  }\n\n  /**\n   * If the data is valid, return an object with isValid set to true\n   * and errors set to null.\n   */\n  return {\n    isValid: true,\n    errors: null,\n  };\n}\n",
      "type": "registry:lib"
    }
  ]
}