{
  "$schema": "https://ui.shadcn.com/schema/registry-item.json",
  "name": "context-menu",
  "type": "registry:ui",
  "title": "ContextMenu",
  "description": "The ContextMenu component.",
  "dependencies": [
    "@radix-ui/react-icons",
    "radix-ui"
  ],
  "files": [
    {
      "path": "registry/default/components/ui/ContextMenu.tsx",
      "content": "\"use client\";\n\nimport * as React from \"react\";\nimport { ContextMenu as ContextMenuRadix } from \"radix-ui\";\nimport {\n  CheckIcon,\n  ChevronRightIcon,\n  DotFilledIcon,\n} from \"@radix-ui/react-icons\";\n\nimport { cn } from \"@/utils/class-names\";\n\nfunction ContextMenu({\n  ...props\n}: React.ComponentProps<typeof ContextMenuRadix.Root>) {\n  return <ContextMenuRadix.Root data-slot=\"context-menu\" {...props} />;\n}\n\nfunction ContextMenuTrigger({\n  className,\n  ...props\n}: React.ComponentProps<typeof ContextMenuRadix.Trigger>) {\n  return (\n    <ContextMenuRadix.Trigger\n      data-slot=\"context-menu-trigger\"\n      className={cn(className)}\n      {...props}\n    />\n  );\n}\n\nfunction ContextMenuGroup({\n  ...props\n}: React.ComponentProps<typeof ContextMenuRadix.Group>) {\n  return <ContextMenuRadix.Group data-slot=\"context-menu-group\" {...props} />;\n}\n\nfunction ContextMenuPortal({\n  ...props\n}: React.ComponentProps<typeof ContextMenuRadix.Portal>) {\n  return <ContextMenuRadix.Portal data-slot=\"context-menu-portal\" {...props} />;\n}\n\nfunction ContextMenuSub({\n  ...props\n}: React.ComponentProps<typeof ContextMenuRadix.Sub>) {\n  return <ContextMenuRadix.Sub data-slot=\"context-menu-sub\" {...props} />;\n}\n\nfunction ContextMenuRadioGroup({\n  className,\n  ...props\n}: React.ComponentProps<typeof ContextMenuRadix.RadioGroup>) {\n  return (\n    <ContextMenuRadix.RadioGroup\n      data-slot=\"context-menu-radio-group\"\n      className={cn(className)}\n      {...props}\n    />\n  );\n}\n\nfunction ContextMenuSubTrigger({\n  children,\n  className,\n  ...props\n}: React.ComponentProps<typeof ContextMenuRadix.SubTrigger>) {\n  return (\n    <ContextMenuRadix.SubTrigger\n      data-slot=\"context-menu-sub-trigger\"\n      className={cn(\n        className,\n        \"p-0.5 px-2 hover:bg-accent-3 flex relative cursor-pointer\"\n      )}\n      {...props}\n    >\n      {children}\n      <div className=\"absolute right-0.5 top-0 bottom-0 items-center flex justify-center\">\n        <ChevronRightIcon />\n      </div>\n    </ContextMenuRadix.SubTrigger>\n  );\n}\n\nfunction ContextMenuSubContent({\n  className,\n  ...props\n}: React.ComponentProps<typeof ContextMenuRadix.SubContent>) {\n  return (\n    <ContextMenuRadix.SubContent\n      data-slot=\"context-menu-sub-content\"\n      className={cn(\n        className,\n        \"bg-gray-1 border border-gray-a6 rounded-sm relative shadow-md\"\n      )}\n      {...props}\n    />\n  );\n}\n\nfunction ContextMenuContent({\n  className,\n  ...props\n}: React.ComponentProps<typeof ContextMenuRadix.Content>) {\n  return (\n    <ContextMenuRadix.Portal>\n      <ContextMenuRadix.Content\n        data-slot=\"context-menu-content\"\n        collisionPadding={8}\n        className={cn(\n          className,\n          \"bg-gray-1 border border-gray-a6 rounded-sm relative shadow-md\"\n        )}\n        {...props}\n      />\n    </ContextMenuRadix.Portal>\n  );\n}\n\nfunction ContextMenuItem({\n  className,\n  ...props\n}: React.ComponentProps<typeof ContextMenuRadix.Item> & {}) {\n  return (\n    <ContextMenuRadix.Item\n      data-slot=\"context-menu-item\"\n      className={cn(\n        className,\n        \"p-0.5 px-2 hover:bg-accent-3 flex relative cursor-pointer justify-between\"\n      )}\n      {...props}\n    />\n  );\n}\n\nfunction ContextMenuCheckboxItem({\n  children,\n  checked,\n  className,\n  ...props\n}: React.ComponentProps<typeof ContextMenuRadix.CheckboxItem>) {\n  return (\n    <ContextMenuRadix.CheckboxItem\n      data-slot=\"context-menu-checkbox-item\"\n      className={cn(\n        className,\n        \"p-0.5 px-2 hover:bg-accent-3 flex relative cursor-pointer\"\n      )}\n      checked={checked}\n      {...props}\n    >\n      <span className=\"absolute left-0.5 top-0 bottom-0 items-center flex justify-center\">\n        <ContextMenuRadix.ItemIndicator>\n          <CheckIcon className=\"text-accent-8\" />\n        </ContextMenuRadix.ItemIndicator>\n      </span>\n      {children}\n    </ContextMenuRadix.CheckboxItem>\n  );\n}\n\nfunction ContextMenuRadioItem({\n  children,\n  className,\n  ...props\n}: React.ComponentProps<typeof ContextMenuRadix.RadioItem>) {\n  return (\n    <ContextMenuRadix.RadioItem\n      data-slot=\"context-menu-radio-item\"\n      className={cn(\n        className,\n        \"p-0.5 px-2 hover:bg-accent-3 flex relative cursor-pointer\"\n      )}\n      {...props}\n    >\n      <span className=\"absolute left-0.5 top-0 bottom-0 items-center flex justify-center\">\n        <ContextMenuRadix.ItemIndicator>\n          <DotFilledIcon className=\"text-accent-8\" />\n        </ContextMenuRadix.ItemIndicator>\n      </span>\n      {children}\n    </ContextMenuRadix.RadioItem>\n  );\n}\n\nfunction ContextMenuLabel({\n  className,\n  ...props\n}: React.ComponentProps<typeof ContextMenuRadix.Label>) {\n  return (\n    <ContextMenuRadix.Label\n      data-slot=\"context-menu-label\"\n      className={cn(className, \"p-0.5 px-2 text-gray-12\")}\n      {...props}\n    />\n  );\n}\n\nfunction ContextMenuSeparator({\n  className,\n  ...props\n}: React.ComponentProps<typeof ContextMenuRadix.Separator>) {\n  return (\n    <ContextMenuRadix.Separator\n      data-slot=\"context-menu-separator\"\n      className={cn(className, \"m-0.6 h-px bg-gray-a6\")}\n      {...props}\n    />\n  );\n}\n\nfunction ContextMenuShortcut({ ...props }: React.ComponentProps<\"span\">) {\n  return <span data-slot=\"context-menu-shortcut\" {...props} />;\n}\n\nexport {\n  ContextMenu,\n  ContextMenuTrigger,\n  ContextMenuContent,\n  ContextMenuItem,\n  ContextMenuCheckboxItem,\n  ContextMenuRadioItem,\n  ContextMenuLabel,\n  ContextMenuSeparator,\n  ContextMenuShortcut,\n  ContextMenuGroup,\n  ContextMenuPortal,\n  ContextMenuSub,\n  ContextMenuSubContent,\n  ContextMenuSubTrigger,\n  ContextMenuRadioGroup,\n};\n",
      "type": "registry:ui"
    }
  ]
}