{
  "$schema": "https://ui.shadcn.com/schema/registry-item.json",
  "name": "rule-fundations-layout-spacing",
  "type": "registry:file",
  "title": "Rule: Fundations Layout Spacing",
  "description": "Aura rule: Fundations Layout Spacing. Install to .cursor/rules/ for Cursor AI guidance.",
  "files": [
    {
      "path": "registry/default/rules/fundations-layout-spacing.mdc",
      "content": "---\ndescription: Enforce Aura 13px spacing for Tailwind v4\nglobs: \"**/*.{tsx,ts,jsx,js,html,css}\"\nalwaysApply: true\ntitle: Spacing guardrails\n---\n\n# Spacing guardrails\n\n`--spacing` is **13px**. Before any `m`/`p`/`gap`/`h`/`w`/`size` utility, compute `unit * 13px` (so `p-4` = 52px, not 16px). Detail in `DESIGN.md`.\n\n* **MUST**: Use the 13px base and 0.5-unit increments only (`1`, `1.5`, `2`, …).\n* **NEVER**: Use non-0.5 increments (`0.2`, `1.2`, …) or arbitrary pixel spacing (`p-[16px]`) unless the human explicitly asks.\n* **MUST**: Convert “about 20px” to `1.5` (19.5px), not `2` (26px).\n* **MUST**: Sections use defined containers (padding, margins, max-width). Prefer ≤ 5 container types per project.\n",
      "type": "registry:file",
      "target": ".cursor/rules/fundations-layout-spacing.mdc"
    }
  ]
}