{
  "$schema": "https://ui.shadcn.com/schema/registry-item.json",
  "name": "menubar",
  "type": "registry:ui",
  "title": "Menubar",
  "description": "The Menubar component.",
  "dependencies": [
    "@radix-ui/react-icons",
    "radix-ui"
  ],
  "registryDependencies": [
    "@aura/class-names"
  ],
  "files": [
    {
      "path": "registry/default/components/ui/Menubar.tsx",
      "content": "\"use client\";\nimport * as React from \"react\";\nimport { Menubar as MenubarRadix } from \"radix-ui\";\nimport {\n  CheckIcon,\n  ChevronRightIcon,\n  DotFilledIcon,\n} from \"@radix-ui/react-icons\";\n\nimport { cn } from \"@/utils/class-names\";\n\nfunction Menubar({\n  className,\n  ...props\n}: React.ComponentProps<typeof MenubarRadix.Root>) {\n  return (\n    <MenubarRadix.Root\n      data-slot=\"menubar\"\n      className={cn(\"flex\", className)}\n      {...props}\n    />\n  );\n}\n\nfunction MenubarMenu({\n  ...props\n}: React.ComponentProps<typeof MenubarRadix.Menu>) {\n  return <MenubarRadix.Menu data-slot=\"menubar-menu\" {...props} />;\n}\n\nfunction MenubarGroup({\n  ...props\n}: React.ComponentProps<typeof MenubarRadix.Group>) {\n  return <MenubarRadix.Group data-slot=\"menubar-group\" {...props} />;\n}\n\nfunction MenubarPortal({\n  ...props\n}: React.ComponentProps<typeof MenubarRadix.Portal>) {\n  return <MenubarRadix.Portal data-slot=\"menubar-portal\" {...props} />;\n}\n\nfunction MenubarRadioGroup({\n  ...props\n}: React.ComponentProps<typeof MenubarRadix.RadioGroup>) {\n  return <MenubarRadix.RadioGroup data-slot=\"menubar-radio-group\" {...props} />;\n}\n\nfunction MenubarTrigger({\n  className,\n  ...props\n}: React.ComponentProps<typeof MenubarRadix.Trigger>) {\n  return (\n    <MenubarRadix.Trigger\n      data-slot=\"menubar-trigger\"\n      className={cn(\n        \"p-0.5 px-2 hover:bg-accent-3 flex relative cursor-pointer\",\n        className\n      )}\n      {...props}\n    />\n  );\n}\n\nfunction MenubarContent({\n  className,\n  ...props\n}: React.ComponentProps<typeof MenubarRadix.Content>) {\n  return (\n    <MenubarPortal>\n      <MenubarRadix.Content\n        data-slot=\"menubar-content\"\n        className={cn(\n          \"z-50 origin-(--radix-menubar-content-transform-origin) bg-gray-1 border border-gray-a6 rounded-sm relative shadow-md data-[state=open]:animate-popover-show data-[state=closed]:animate-popover-hide\",\n          className\n        )}\n        {...props}\n      />\n    </MenubarPortal>\n  );\n}\n\nfunction MenubarItem({\n  className,\n  ...props\n}: React.ComponentProps<typeof MenubarRadix.Item>) {\n  return (\n    <MenubarRadix.Item\n      data-slot=\"menubar-item\"\n      className={cn(\n        \"p-0.5 px-2 hover:bg-accent-3 flex relative cursor-pointer justify-between\",\n        className\n      )}\n      {...props}\n    />\n  );\n}\n\nfunction MenubarCheckboxItem({\n  children,\n  className,\n  ...props\n}: React.ComponentProps<typeof MenubarRadix.CheckboxItem>) {\n  return (\n    <MenubarRadix.CheckboxItem\n      data-slot=\"menubar-checkbox-item\"\n      className={cn(\n        \"p-0.5 px-2 hover:bg-accent-3 flex relative cursor-pointer\",\n        className\n      )}\n      {...props}\n    >\n      <span className=\"absolute left-0.5 top-0 bottom-0 items-center flex justify-center\">\n        <MenubarRadix.ItemIndicator>\n          <CheckIcon className=\"text-accent-9\" />\n        </MenubarRadix.ItemIndicator>\n      </span>\n      {children}\n    </MenubarRadix.CheckboxItem>\n  );\n}\n\nfunction MenubarRadioItem({\n  children,\n  className,\n  ...props\n}: React.ComponentProps<typeof MenubarRadix.RadioItem>) {\n  return (\n    <MenubarRadix.RadioItem\n      data-slot=\"menubar-radio-item\"\n      className={cn(\n        \"p-0.5 px-2 hover:bg-accent-3 flex relative cursor-pointer\",\n        className\n      )}\n      {...props}\n    >\n      <span className=\"absolute left-0.5 top-0 bottom-0 items-center flex justify-center\">\n        <MenubarRadix.ItemIndicator>\n          <DotFilledIcon className=\"fill-current text-accent-9\" />\n        </MenubarRadix.ItemIndicator>\n      </span>\n      {children}\n    </MenubarRadix.RadioItem>\n  );\n}\n\nfunction MenubarLabel({\n  className,\n  ...props\n}: React.ComponentProps<typeof MenubarRadix.Label>) {\n  return (\n    <MenubarRadix.Label\n      data-slot=\"menubar-label\"\n      className={cn(\"p-0.5 px-2 text-gray-12\", className)}\n      {...props}\n    />\n  );\n}\n\nfunction MenubarSeparator({\n  className,\n  ...props\n}: React.ComponentProps<typeof MenubarRadix.Separator>) {\n  return (\n    <MenubarRadix.Separator\n      data-slot=\"menubar-separator\"\n      className={cn(\"m-0.6 h-px bg-gray-a6\", className)}\n      {...props}\n    />\n  );\n}\n\nfunction MenubarShortcut({ ...props }: React.ComponentProps<\"span\">) {\n  return <span data-slot=\"menubar-shortcut\" {...props} />;\n}\n\nfunction MenubarSub({\n  ...props\n}: React.ComponentProps<typeof MenubarRadix.Sub>) {\n  return <MenubarRadix.Sub data-slot=\"menubar-sub\" {...props} />;\n}\n\nfunction MenubarSubTrigger({\n  children,\n  className,\n  ...props\n}: React.ComponentProps<typeof MenubarRadix.SubTrigger> & {\n  inset?: boolean;\n}) {\n  return (\n    <MenubarRadix.SubTrigger\n      data-slot=\"menubar-sub-trigger\"\n      className={cn(\n        \"p-0.5 px-2 hover:bg-accent-3 flex relative cursor-pointer\",\n        className\n      )}\n      {...props}\n    >\n      {children}\n      <div className=\"absolute right-0.5 top-0 bottom-0 items-center flex justify-center\">\n        <ChevronRightIcon />\n      </div>\n    </MenubarRadix.SubTrigger>\n  );\n}\n\nfunction MenubarSubContent({\n  className,\n  ...props\n}: React.ComponentProps<typeof MenubarRadix.SubContent>) {\n  return (\n    <MenubarRadix.SubContent\n      data-slot=\"menubar-sub-content\"\n      className={cn(\n        \"z-50 origin-(--radix-menubar-content-transform-origin) bg-gray-1 border border-gray-a6 rounded-sm relative shadow-md data-[state=open]:animate-popover-show data-[state=closed]:animate-popover-hide\",\n        className\n      )}\n      {...props}\n    />\n  );\n}\n\nexport {\n  Menubar,\n  MenubarPortal,\n  MenubarMenu,\n  MenubarTrigger,\n  MenubarContent,\n  MenubarGroup,\n  MenubarSeparator,\n  MenubarLabel,\n  MenubarItem,\n  MenubarShortcut,\n  MenubarCheckboxItem,\n  MenubarRadioGroup,\n  MenubarRadioItem,\n  MenubarSub,\n  MenubarSubTrigger,\n  MenubarSubContent,\n};\n\n",
      "type": "registry:ui"
    },
    {
      "path": "registry/default/styles/menubar.css",
      "content": "@import \"./popover.css\";\n",
      "type": "registry:component",
      "target": "./styles/menubar.css"
    }
  ],
  "css": {
    "@layer components": {
      "@import \"../styles/menubar.css\"": {}
    }
  }
}