{
  "$schema": "https://auradesignsystem.com/r/registry-items/default.json",
  "name": "default",
  "type": "registry:style",
  "dependencies": ["@aura-design/system", "@radix-ui/react-icons"],
  "registryDependencies": [
    "https://auradesignsystem.com/r/layout-pancake.json",
    "https://auradesignsystem.com/r/home-hello.json"
  ],
  "css": {
    "@layer base": {
      "html": {
        "font-size": "17px"
      }
    }
  },
  "cssVars": {
    "theme": {
      "font-sans": "Inter, sans-serif",
      "info": "#e8ebfe",
      "info-contrast": "#0927ec",
      "success": "#e8fef7",
      "success-contrast": "#045d3c",
      "danger": "#feefe8",
      "danger-contrast": "#8e3106",
      "warning": "#fefbe8",
      "warning-contrast": "#5d5104",
      "radius-0.5": "calc(var(--spacing) * 0.5)",
      "radius-1": "calc(var(--spacing) * 1)",
      "radius-1.5": "calc(var(--spacing) * 1.5)",
      "radius-2": "calc(var(--spacing) * 2)"
    },
    "light": {
      "aura-loader": "var(--primary)",
      "radius": "13px",
      "background": "#fcfcff",
      "foreground": "#2c2c3b"
    },
    "dark": {
      "background": "#2c2c3b",
      "foreground": "#fcfcff"
    }
  },
  "extends": "none"
}
