{
  "$schema": "https://ui.shadcn.com/schema/registry-item.json",
  "name": "toolbar",
  "type": "registry:ui",
  "title": "Toolbar",
  "description": "The Toolbar component.",
  "registryDependencies": [
    "@aura/class-names"
  ],
  "files": [
    {
      "path": "registry/default/components/ui/Toolbar.tsx",
      "content": "\"use client\";\n\nimport * as React from \"react\";\nimport { cn } from \"@/utils/class-names\";\n\nfunction Toolbar({\n  className,\n  label = \"Toolbar\",\n  ...props\n}: React.ComponentProps<\"div\"> & { label?: string }) {\n  return (\n    <div\n      role=\"toolbar\"\n      aria-label={label}\n      data-slot=\"toolbar\"\n      className={cn(\n        \"inline-flex flex-wrap items-center gap-2 rounded-sm border border-gray-6 bg-gray-1 p-0.5\",\n        className,\n      )}\n      {...props}\n      onKeyDown={(event) => {\n        props.onKeyDown?.(event);\n        if (event.defaultPrevented) return;\n        const items = event.currentTarget.querySelectorAll<HTMLElement>(\n          \"[data-slot='toolbar-button']:not([disabled])\",\n        );\n        const list = Array.from(items);\n        const index = list.indexOf(document.activeElement as HTMLElement);\n        if (index < 0) return;\n        if (event.key === \"ArrowRight\") {\n          event.preventDefault();\n          list[(index + 1) % list.length]?.focus();\n        } else if (event.key === \"ArrowLeft\") {\n          event.preventDefault();\n          list[(index - 1 + list.length) % list.length]?.focus();\n        }\n      }}\n    />\n  );\n}\n\nfunction ToolbarButton({\n  className,\n  pressed,\n  ...props\n}: React.ComponentProps<\"button\"> & { pressed?: boolean }) {\n  return (\n    <button\n      type=\"button\"\n      data-slot=\"toolbar-button\"\n      aria-pressed={pressed}\n      className={cn(\n        \"inline-flex size-3 items-center justify-center rounded-sm text-gray-12 hover:bg-gray-3 focus-visible:outline-none focus-visible:ring-2 focus-visible:ring-accent-8 aria-pressed:bg-accent-3\",\n        className,\n      )}\n      {...props}\n    />\n  );\n}\n\nfunction ToolbarSeparator({ className, ...props }: React.ComponentProps<\"div\">) {\n  return (\n    <div\n      role=\"separator\"\n      aria-orientation=\"vertical\"\n      data-slot=\"toolbar-separator\"\n      className={cn(\"mx-0.5 h-2 w-px bg-gray-6\", className)}\n      {...props}\n    />\n  );\n}\n\nexport { Toolbar, ToolbarButton, ToolbarSeparator };\n",
      "type": "registry:ui"
    }
  ]
}