{
  "$schema": "https://ui.shadcn.com/schema/registry-item.json",
  "name": "skill-update-project-brain",
  "type": "registry:file",
  "title": "Skill: Update Project Brain",
  "description": "Aura Cursor skill: Update Project Brain. Installs to .cursor/skills/update-project-brain/.",
  "files": [
    {
      "path": "registry/default/skills/update-project-brain/SKILL.md",
      "content": "---\nname: update-project-brain\ndescription: >-\n  Persist Project Brain notes in wiki/obsidian-*, sync Bruno API parity, and\n  update Internal-Progress.md after architectural decisions, complex fixes,\n  API changes, or session advances. Use when documentation must be written or\n  Internal Progress needs a session entry.\n---\n\n# Update Project Brain\n\nGuardrails (when / where / note shape) live in `.cursor/rules/self-documenting-system.mdc`. This skill is the write loop.\n\n## Paths\n\nResolve the vault from the blueprint wiki:\n\n* Vault: `wiki/obsidian-*/` (this monorepo: `wiki/obsidian-aura-design-project/`)\n* Bruno: `wiki/bruno-*/` (this monorepo: `wiki/bruno-aura-design-project/`)\n* Progress: `<vault>/00-General/Internal-Progress.md`\n* Layout authority: `Bootstrap.md` and `Welcome.md`\n\nConsumer apps derive `{suffix}` from `package.json` `name` (first segment stripped) → `wiki/obsidian-{suffix}/`.\n\n## When to run\n\nRun immediately after any of these.\n\n1. Architectural decision or non-obvious logic.\n2. Bug fix that took more than two iterations.\n3. Change under `app/api/**` (or route contract change).\n4. End of a work unit or session (always touch Internal Progress).\n\n## Create or update an Obsidian note\n\n1. Pick the folder: `00-General`, `01-Identity`, `02-Documentation`, or `03-Configuración`.\n2. Prefer updating an existing note over a new file when the topic already exists. Search the vault first.\n3. New notes use this frontmatter and body shape:\n\n```yaml\n---\ntitle: [Short Descriptive Title]\ndate: YYYY-MM-DD\ntags: [dev-log, logic, architecture]\n---\n## Summary\n[3–4 sentences max. Why + what changed.]\n\n## Context\n- Related: [[OtherNote]]\n- Implementation Path: `path/to/file`\n```\n\n4. Use `[[wikilinks]]`. Cite code with paths like `` `app/api/...` ``. Env **names** only. No secrets.\n5. For API work, open the matching Bruno request under `wiki/bruno-*/`, align method/URL/examples with `APP_URL`, and leave auth as comments per `AI-PROMPT.md`.\n\n## Update Internal Progress (session end — always)\n\n1. In `00-General/Internal-Progress.md`, add ONE entry at the top of `## Sessions` (closed shape: Summary, Active, Sessions, Context):\n\n       ### 2026-10-10 · Short title of the advance\n       - What changed and why (≤5 bullets, ≤120 words). Link the topic note: [[Aura Agent Surface]].\n\n2. Edit `## Active` only if open work changed: add `- [ ] … (since YYYY-MM-DD)`,\n   or tick `- [x]` what you finished. Never write open work inside a session entry.\n3. Rewrite `## Summary` only if the project's current state changed (≤4 sentences).\n4. If the project has `pnpm brain:progress`, run it. It trims and archives for you. Do not delete sessions by hand.\n5. If it prints `PROMOTE`, the evicted entry had no [[wikilink]]; move its durable fact into a\n   topic note (or Summary), then re-run. Archive already holds the verbatim text.\n\n## Done when\n\n* [ ] The advance has a note (new or updated) under the vault.\n* [ ] API changes have Bruno parity when `app/api/**` moved.\n* [ ] `Internal-Progress.md` has one new Sessions entry. `pnpm brain:progress` exits 0 when present.\n* [ ] No secrets landed in markdown.\n",
      "type": "registry:file",
      "target": ".cursor/skills/update-project-brain/SKILL.md"
    }
  ]
}