{
  "$schema": "https://ui.shadcn.com/schema/registry-item.json",
  "name": "native-select",
  "type": "registry:ui",
  "title": "NativeSelect",
  "description": "The NativeSelect component.",
  "dependencies": [
    "@radix-ui/react-icons"
  ],
  "registryDependencies": [
    "@aura/class-names"
  ],
  "files": [
    {
      "path": "registry/default/components/ui/NativeSelect.tsx",
      "content": "\"use client\";\nimport * as React from \"react\";\nimport { ChevronDownIcon } from \"@radix-ui/react-icons\";\n\nimport { cn } from \"@/utils/class-names\";\n\nfunction NativeSelect({\n  className,\n  children,\n  ...props\n}: React.ComponentProps<\"select\">) {\n  return (\n    <div data-slot=\"native-select\" className=\"relative w-full\">\n      <select className={cn(\"w-full pe-4\", className)} {...props}>\n        {children}\n      </select>\n      <span className=\"pointer-events-none absolute inset-y-0 end-1 flex items-center\">\n        <ChevronDownIcon className=\"icon\" aria-hidden />\n      </span>\n    </div>\n  );\n}\n\nfunction NativeSelectGroup(props: React.ComponentProps<\"optgroup\">) {\n  return <optgroup data-slot=\"native-select-group\" {...props} />;\n}\n\nfunction NativeSelectOption(props: React.ComponentProps<\"option\">) {\n  return <option data-slot=\"native-select-option\" {...props} />;\n}\n\nexport { NativeSelect, NativeSelectGroup, NativeSelectOption };\n\n",
      "type": "registry:ui"
    }
  ]
}