{
  "$schema": "https://ui.shadcn.com/schema/registry-item.json",
  "name": "compose-refs",
  "type": "registry:lib",
  "title": "compose-refs",
  "description": "Utility: compose-refs",
  "files": [
    {
      "path": "registry/default/utils/compose-refs.tsx",
      "content": " \nimport * as React from \"react\";\n \ntype PossibleRef<T> = React.Ref<T> | undefined;\n \nfunction setRef<T>(ref: PossibleRef<T>, value: T) {\n  if (typeof ref === \"function\") {\n    return ref(value);\n  }\n \n  if (ref !== null && ref !== undefined) {\n    ref.current = value;\n  }\n}\n \nfunction composeRefs<T>(...refs: PossibleRef<T>[]): React.RefCallback<T> {\n  return (node) => {\n    let hasCleanup = false;\n    const cleanups = refs.map((ref) => {\n      const cleanup = setRef(ref, node);\n      if (!hasCleanup && typeof cleanup === \"function\") {\n        hasCleanup = true;\n      }\n      return cleanup;\n    });\n \n    if (hasCleanup) {\n      return () => {\n        for (let i = 0; i < cleanups.length; i++) {\n          const cleanup = cleanups[i];\n          if (typeof cleanup === \"function\") {\n            cleanup();\n          } else {\n            setRef(refs[i], null);\n          }\n        }\n      };\n    }\n  };\n}\n \nfunction useComposedRefs<T>(...refs: PossibleRef<T>[]): React.RefCallback<T> {\n  return React.useCallback(composeRefs(...refs), refs);\n}\n \nfunction composeEventHandlers<E extends { defaultPrevented: boolean }>(\n  originalEventHandler?: (event: E) => void,\n  ourEventHandler?: (event: E) => void,\n  { checkForDefaultPrevented = true } = {},\n) {\n  return function handleEvent(event: E) {\n    originalEventHandler?.(event);\n    if (checkForDefaultPrevented === false || !event.defaultPrevented) {\n      return ourEventHandler?.(event);\n    }\n  };\n}\n\nexport { composeRefs, useComposedRefs, composeEventHandlers };",
      "type": "registry:lib"
    }
  ]
}