{
  "$schema": "https://ui.shadcn.com/schema/registry-item.json",
  "name": "Tooltip",
  "type": "registry:ui",
  "description": "A popup that displays information related to an element when the element receives keyboard focus or the mouse hovers over it.",
  "files": [
    {
      "path": "registry/default/ui/Tooltip.tsx",
      "content": "\"use client\";\n\nimport * as React from \"react\";\nimport { Tooltip as TooltipPrimitive } from \"radix-ui\";\n\nimport { cn } from \"@/lib/utils\";\n\nfunction TooltipProvider({\n  delayDuration = 0,\n  ...props\n}: React.ComponentProps<typeof TooltipPrimitive.Provider>) {\n  return (\n    <TooltipPrimitive.Provider\n      data-slot=\"tooltip-provider\"\n      delayDuration={delayDuration}\n      {...props}\n    />\n  );\n}\n\nfunction Tooltip({\n  ...props\n}: React.ComponentProps<typeof TooltipPrimitive.Root>) {\n  return (\n    <TooltipProvider>\n      <TooltipPrimitive.Root data-slot=\"tooltip\" {...props} />\n    </TooltipProvider>\n  );\n}\n\nfunction TooltipTrigger({\n  ...props\n}: React.ComponentProps<typeof TooltipPrimitive.Trigger>) {\n  return <TooltipPrimitive.Trigger data-slot=\"tooltip-trigger\" {...props} />;\n}\n\nfunction TooltipContent({\n  className,\n  children,\n  ...props\n}: React.ComponentProps<typeof TooltipPrimitive.Content>) {\n  return (\n    <TooltipPrimitive.Portal>\n      <TooltipPrimitive.Content\n        data-slot=\"tooltip-content\"\n        className={cn(className)}\n        {...props}\n      >\n        {children}\n        <TooltipPrimitive.Arrow />\n      </TooltipPrimitive.Content>\n    </TooltipPrimitive.Portal>\n  );\n}\n\nexport { Tooltip, TooltipTrigger, TooltipContent, TooltipProvider };\n",
      "type": "registry:ui"
    }
  ]
}